{
  "analyzed_source_commit": "9a4616e77f0f9cbcbecaf27d711c38890dda1404",
  "included_paths": [
    "src/cartservice",
    "src/checkoutservice",
    "src/shippingservice"
  ],
  "excluded_paths": [
    {
      "path": "src/frontend",
      "reason": "service outside the selected three-service scope"
    },
    {
      "path": "src/loadgenerator",
      "reason": "service outside the selected three-service scope"
    },
    {
      "path": "src/adservice",
      "reason": "service outside the selected three-service scope"
    },
    {
      "path": "src/recommendationservice",
      "reason": "service outside the selected three-service scope"
    },
    {
      "path": "src/shoppingassistantservice",
      "reason": "service outside the selected three-service scope"
    },
    {
      "path": "src/currencyservice",
      "reason": "service outside the selected three-service scope"
    },
    {
      "path": "src/emailservice",
      "reason": "service outside the selected three-service scope"
    },
    {
      "path": "src/paymentservice",
      "reason": "service outside the selected three-service scope"
    },
    {
      "path": "src/productcatalogservice",
      "reason": "service outside the selected three-service scope"
    },
    {
      "path": "src/checkoutservice/genproto",
      "reason": "machine-generated protobuf bindings marked 'Code generated by protoc-gen-go. DO NOT EDIT.'; generated code is not a documentation surface and its 3789 lines would make human-reviewable gold impossible"
    },
    {
      "path": "src/shippingservice/genproto",
      "reason": "machine-generated protobuf bindings marked 'Code generated by protoc-gen-go. DO NOT EDIT.'; generated code is not a documentation surface and its 3789 lines would make human-reviewable gold impossible"
    },
    {
      "path": ".git",
      "reason": "version-control metadata"
    }
  ],
  "file_counts": {
    "supported": 16,
    "unsupported": 20,
    "failed": 0,
    "skipped": 0
  },
  "truncated": false,
  "truncated_inputs": [],
  "module_extractors": [
    {
      "module": "src/cartservice",
      "actor_id": "extractor-ext3"
    },
    {
      "module": "src/checkoutservice",
      "actor_id": "extractor-ext3"
    },
    {
      "module": "src/shippingservice",
      "actor_id": "extractor-ext3"
    }
  ],
  "writer_actor_id": "writer-ext3",
  "draft_digest": "155ac67a50743a6fd3e8e0d1c5c231bc564442ba1efbe66c449a42cdd9d9f1f8"
}
